{
  "api_version": "2",
  "retrieval_request_id": "retrieval-1",
  "delivered_value_ids": ["value-1"],
  "items": [
    {
      "value_id": "value-1",
      "primary_object_id": "obj-postgresql",
      "object_name": "PostgreSQL",
      "facet": "function",
      "content": "PostgreSQL accepts SQL queries.",
      "relevance": 0.87,
      "explanation": {
        "object_reasons": ["direct_value_semantic"],
        "item_facet": "function",
        "activated_facets": [
          {"facet": "procedure", "score": 0.44, "signals": ["how"]}
        ],
        "score_components": {
          "semantic": 0.92,
          "object": 0.0,
          "facet": 0.44,
          "scope_time": 1.0,
          "context": 0.0,
          "recency": 0.5,
          "support": 0.4,
          "usage": 0.1
        }
      }
    }
  ]
}
